[
  {
    "id": "STORY-001",
    "persona": "减脂中的健身用户",
    "need": "我想通过拍照快速获得食物热量估算，并决定是否保存本次记录",
    "benefit": "以更低操作成本完成饮食记录，提升持续记录意愿",
    "story_statement": "作为一名减脂中的健身用户，我希望在吃饭前或吃饭后拍摄食物照片并快速看到热量估算结果，这样我就能减少手动搜索录入的麻烦并更容易坚持记录饮食。",
    "acceptance_criteria": [
      "当用户进入“饮食拍照”入口时，系统应在2步内允许其选择“拍照”或“从相册选择单张图片”。",
      "当用户首次使用相机或相册功能且未授权时，系统必须弹出对应权限申请；若用户拒绝，系统必须展示明确的失败原因和可执行的再次授权引导。",
      "当用户成功提交图片后，系统必须在1秒内展示“识别中”状态，直到返回结果或失败提示。",
      "当识别成功时，结果页必须展示至少一项食物名称或类别，以及一个热量估算值或区间。",
      "结果页必须展示“热量为估算值，仅供参考”或等价免责声明，且该文案在用户可视区域内。",
      "当识别失败、超时或无可信结果时，系统必须展示明确失败提示，并提供“重试”操作。",
      "当用户点击“保存”时，系统必须提示保存成功；若MVP未落地历史记录，也必须完成保存按钮点击埋点并给出明确反馈。"
    ],
    "priority": "p0",
    "dependencies": [
      "食物识别与热量估算服务",
      "移动端相机权限",
      "移动端相册权限",
      "基础埋点能力"
    ],
    "edge_cases": [
      "图片模糊、过暗、反光导致无法识别",
      "餐盘中存在多种食物但系统仅能给出单一类别结果",
      "地域性食物或包装食品不在数据库覆盖范围内",
      "网络超时或第三方识别服务异常"
    ]
  },
  {
    "id": "STORY-002",
    "persona": "力量训练用户",
    "need": "我想在每组结束后快速启动休息倒计时，并在结束时收到提醒",
    "benefit": "按计划控制组间休息时长，减少看表和手动记时负担",
    "story_statement": "作为一名力量训练用户，我希望在每组训练结束后快速启动组间休息倒计时，并在倒计时结束时收到提醒，这样我就能更稳定地控制训练节奏。",
    "acceptance_criteria": [
      "当用户进入“组间歇闹钟”页面时，系统必须默认展示可编辑的休息时长输入项和“开始计时”按钮。",
      "当用户设置一个有效休息时长并点击“开始计时”后，系统必须立即开始倒计时并展示剩余时间。",
      "计时过程中，系统必须提供“暂停”“继续”“结束”三个可用操作。",
      "当用户点击“暂停”后，剩余时间必须停止减少；当用户点击“继续”后，倒计时必须从暂停时的剩余时间继续。",
      "当倒计时自然结束时，系统必须通过声音、震动或系统通知中的至少一种方式提醒用户。",
      "当用户在未设置有效时长、设置为0或输入非法值时，系统不得开始计时，并必须展示可理解的错误提示。",
      "系统必须记录计时启动、暂停、继续、自然完成和提前结束事件。"
    ],
    "priority": "p0",
    "dependencies": [
      "移动端计时能力",
      "声音或震动提醒能力",
      "通知权限（如使用通知提醒）",
      "基础埋点能力"
    ],
    "edge_cases": [
      "用户在计时过程中切到其他页面或最小化应用",
      "设备静音导致声音提醒不可感知",
      "用户连续快速点击开始按钮导致重复启动多个计时",
      "输入超长休息时长或非数字字符"
    ]
  },
  {
    "id": "STORY-003",
    "persona": "间歇训练用户",
    "need": "我想设置训练/休息时长与循环次数，并持续获得阶段切换提醒",
    "benefit": "在HIIT等训练中无需反复手动操作，保持训练连贯性",
    "story_statement": "作为一名间歇训练用户，我希望设置训练时长、休息时长和循环次数，并自动获得每个阶段切换提醒，这样我就能专注训练而不是反复看表和操作计时器。",
    "acceptance_criteria": [
      "当用户进入循环计时模式时，系统必须允许其设置训练时长、休息时长和循环次数。",
      "当用户填写的训练时长、休息时长和循环次数均为有效值时，点击“开始”后系统必须从第1轮训练阶段开始计时。",
      "系统必须在界面上持续展示当前阶段（训练或休息）、当前轮次和剩余时间。",
      "当训练阶段结束时，系统必须自动切换到休息阶段，并给出明确提醒。",
      "当休息阶段结束时，若未达到设定循环次数，系统必须自动进入下一轮训练阶段；若已达到循环次数，系统必须结束并给出完成提醒。",
      "计时过程中，系统必须支持暂停、继续和提前结束，且操作后状态变化应正确可见。",
      "当用户输入0、空值、负数或超出允许范围的循环次数/时长时，系统不得开始计时，并必须展示错误提示。"
    ],
    "priority": "p1",
    "dependencies": [
      "移动端计时能力",
      "声音或震动提醒能力",
      "通知权限（如使用通知提醒）",
      "基础埋点能力"
    ],
    "edge_cases": [
      "训练和休息时长设置相同，用户难以区分阶段",
      "循环次数设置为1时应仅完成一轮训练+休息或按产品定义执行",
      "用户在最后一轮休息结束前提前终止",
      "应用切后台后计时显示与实际剩余时间不同步"
    ]
  },
  {
    "id": "STORY-004",
    "persona": "产品运营/数据分析人员",
    "need": "我想看到两个核心功能的关键使用数据",
    "benefit": "验证MVP是否具备用户价值，并支持后续范围收敛",
    "story_statement": "作为一名产品运营/数据分析人员，我希望系统记录食物拍照识别和训练计时的关键行为数据，这样我就能评估MVP核心价值是否成立并发现主要流失点。",
    "acceptance_criteria": [
      "系统必须记录“饮食拍照入口曝光”和“入口点击”事件，并包含事件时间、匿名用户标识和模块标识。",
      "系统必须记录拍照提交、识别成功、识别失败、结果保存点击事件，并能区分相机拍摄与相册选择来源。",
      "系统必须记录单次计时启动、暂停、继续、自然完成、提前结束事件。",
      "系统必须记录循环计时启动、阶段切换、完成、中途退出事件。",
      "每条埋点数据必须至少包含：事件名、事件时间、匿名用户标识、功能模块、结果状态。",
      "当网络异常导致埋点上报失败时，系统不得影响用户完成核心流程。",
      "测试环境下应能通过事件查询或日志验证上述事件已按触发条件产生。"
    ],
    "priority": "p1",
    "dependencies": [
      "埋点SDK或日志系统",
      "匿名用户标识方案",
      "数据接收与查询能力"
    ],
    "edge_cases": [
      "用户未登录导致仅能使用匿名标识",
      "用户快速重复点击引发事件重复上报",
      "离线状态下埋点延迟发送或丢失",
      "不同平台事件字段不一致导致无法汇总分析"
    ]
  }
]
