[
  {
    "id": "STORY-001",
    "persona": "商家客户（尤其大客户）",
    "need": "完成“商家财务流水批量导出”的核心操作",
    "benefit": "更快完成主流程任务",
    "story_statement": "作为商家客户（尤其大客户），我希望能完成“商家财务流水批量导出”的核心操作，以便更快完成业务目标。",
    "acceptance_criteria": [
      "用户可以在主流程入口完成核心操作",
      "系统对关键字段和必填项进行校验",
      "成功结果可被用户确认并用于后续业务处理"
    ],
    "priority": "p1",
    "dependencies": [
      "财务流水数据源及字段口径确认",
      "权限模型确认（商家可见范围、子账号范围、客服代导出权限等）",
      "导出文件格式与模板设计确认",
      "可能需要后端导出任务能力与下载链路支持",
      "可能需要审计日志、数据脱敏或合规评审支持"
    ],
    "edge_cases": [
      "导出的核心目标用户是谁：商家自助导出，还是客服后台代导出，或两者都要？",
      "“财务流水”具体包含哪些业务单据/资金变动类型？"
    ]
  },
  {
    "id": "STORY-002",
    "persona": "客服",
    "need": "快速查看结果并响应异常",
    "benefit": "减少人工沟通和重复处理",
    "story_statement": "作为客服，我希望能快速定位处理结果和异常原因，以便减少人工支持成本。",
    "acceptance_criteria": [
      "系统展示关键状态或结果信息",
      "异常时有明确原因或下一步提示",
      "必要时支持追踪操作记录"
    ],
    "priority": "p1",
    "dependencies": [
      "财务流水数据源及字段口径确认",
      "权限模型确认（商家可见范围、子账号范围、客服代导出权限等）",
      "导出文件格式与模板设计确认",
      "可能需要后端导出任务能力与下载链路支持",
      "可能需要审计日志、数据脱敏或合规评审支持"
    ],
    "edge_cases": [
      "导出字段清单、字段定义、排序方式、筛选条件分别是什么？",
      "数据权限如何定义：按商家、门店、账号、时间范围还是资金账户隔离？"
    ]
  },
  {
    "id": "STORY-003",
    "persona": "管理员",
    "need": "控制功能访问权限",
    "benefit": "降低越权和合规风险",
    "story_statement": "作为管理员，我希望能按角色控制功能访问权限，以便降低越权风险。",
    "acceptance_criteria": [
      "无权限用户不可见或不可执行对应操作",
      "权限校验失败时返回明确提示",
      "关键操作写入审计日志"
    ],
    "priority": "p1",
    "dependencies": [
      "权限系统",
      "审计日志能力"
    ],
    "edge_cases": [
      "角色切换后的权限是否实时生效",
      "批量操作是否需要单独审计"
    ]
  }
]
